{
  "$defs": {
    "CollectorError": {
      "additionalProperties": false,
      "properties": {
        "capability": {
          "anyOf": [
            {
              "maxLength": 4096,
              "minLength": 1,
              "type": "string"
            },
            {
              "type": "null"
            }
          ],
          "default": null,
          "title": "Capability"
        },
        "code": {
          "enum": [
            "UNSUPPORTED",
            "AUTH_FAILED",
            "TIMEOUT",
            "PARSE_ERROR",
            "MISSING_EVIDENCE",
            "DEVICE_UNAVAILABLE"
          ],
          "title": "Code",
          "type": "string"
        },
        "message": {
          "maxLength": 4096,
          "minLength": 1,
          "title": "Message",
          "type": "string"
        },
        "retryable": {
          "title": "Retryable",
          "type": "boolean"
        }
      },
      "required": [
        "code",
        "message",
        "retryable"
      ],
      "title": "CollectorError",
      "type": "object"
    },
    "EvidenceRef": {
      "additionalProperties": false,
      "properties": {
        "collected_at": {
          "pattern": "^\\d{4}-\\d{2}-\\d{2}T\\d{2}:\\d{2}:\\d{2}(\\.\\d+)?Z$",
          "title": "Collected At",
          "type": "string"
        },
        "encrypted_artifact_location": {
          "pattern": "^private://[a-z0-9-]+/[a-zA-Z0-9/_-]+$",
          "title": "Encrypted Artifact Location",
          "type": "string"
        },
        "evidence_id": {
          "format": "uuid",
          "title": "Evidence Id",
          "type": "string"
        },
        "sha256": {
          "pattern": "^[a-f0-9]{64}$",
          "title": "Sha256",
          "type": "string"
        },
        "source_identity": {
          "maxLength": 4096,
          "minLength": 1,
          "title": "Source Identity",
          "type": "string"
        }
      },
      "required": [
        "evidence_id",
        "sha256",
        "source_identity",
        "encrypted_artifact_location",
        "collected_at"
      ],
      "title": "EvidenceRef",
      "type": "object"
    }
  },
  "$schema": "https://json-schema.org/draft/2020-12/schema",
  "additionalProperties": false,
  "properties": {
    "change_id": {
      "format": "uuid",
      "title": "Change Id",
      "type": "string"
    },
    "completed_action_ids": {
      "items": {
        "format": "uuid",
        "type": "string"
      },
      "title": "Completed Action Ids",
      "type": "array"
    },
    "errors": {
      "items": {
        "$ref": "#/$defs/CollectorError"
      },
      "title": "Errors",
      "type": "array"
    },
    "evidence_refs": {
      "items": {
        "$ref": "#/$defs/EvidenceRef"
      },
      "title": "Evidence Refs",
      "type": "array"
    },
    "job_id": {
      "format": "uuid",
      "title": "Job Id",
      "type": "string"
    },
    "org_id": {
      "format": "uuid",
      "title": "Org Id",
      "type": "string"
    },
    "schema_version": {
      "const": "1.0.0",
      "title": "Schema Version",
      "type": "string"
    },
    "state": {
      "enum": [
        "VERIFYING",
        "FAILED",
        "ROLLED_BACK",
        "NEEDS_MANUAL_RECOVERY"
      ],
      "title": "State",
      "type": "string"
    }
  },
  "required": [
    "schema_version",
    "org_id",
    "job_id",
    "change_id",
    "state",
    "evidence_refs",
    "errors",
    "completed_action_ids"
  ],
  "title": "ExecutionResult",
  "type": "object"
}
