{
  "change_id": "00000000-0000-0000-0000-000000000012",
  "completed_action_ids": [],
  "errors": [
    {
      "capability": null,
      "code": "UNSUPPORTED",
      "message": "Synthetic offline fixture; no device implementation",
      "retryable": false
    }
  ],
  "evidence_refs": [],
  "job_id": "00000000-0000-0000-0000-000000000002",
  "org_id": "00000000-0000-0000-0000-000000000001",
  "schema_version": "1.0.0",
  "state": "FAILED"
}
